[
 {
  "sim_id": "SIM-R1-C0",
  "cycle": "C0",
  "report": "R1",
  "iteration": null,
  "archived": false,
  "directory": "Report-1-Body/simulation",
  "script": "Report-1-Body/simulation/sim_homeostasis.py",
  "spec": "Report-1-Body/simulation/SPEC.md",
  "params": "Report-1-Body/simulation/params.json",
  "execution_record": "Report-1-Body/simulation/EXECUTION_RECORD.json",
  "params_sha256": "906da12a4e9f9aeb29eb0ef1391ffbc8ee41ab6bcab63bcc0ac343dd310dca88",
  "n_checks": 7,
  "results": {
   "Pass": 7,
   "Fail": 0,
   "Supported": 0,
   "Not supported": 0,
   "Reported": 0,
   "Indeterminate": 0
  }
 },
 {
  "sim_id": "SIM-R2-C0",
  "cycle": "C0",
  "report": "R2",
  "iteration": null,
  "archived": false,
  "directory": "Report-2-Mind/simulation",
  "script": "Report-2-Mind/simulation/sim_mind.py",
  "spec": "Report-2-Mind/simulation/SPEC.md",
  "params": "Report-2-Mind/simulation/params.json",
  "execution_record": "Report-2-Mind/simulation/EXECUTION_RECORD.json",
  "params_sha256": "66fa954449d8b2c270444a308e5bffea4a4c628a5e15945cfd3deebd90759510",
  "n_checks": 4,
  "results": {
   "Pass": 4,
   "Fail": 0,
   "Supported": 0,
   "Not supported": 0,
   "Reported": 0,
   "Indeterminate": 0
  }
 },
 {
  "sim_id": "SIM-R3-C0",
  "cycle": "C0",
  "report": "R3",
  "iteration": null,
  "archived": false,
  "directory": "Report-3-Soul/simulation",
  "script": "Report-3-Soul/simulation/sim_soul.py",
  "spec": "Report-3-Soul/simulation/SPEC.md",
  "params": "Report-3-Soul/simulation/params.json",
  "execution_record": "Report-3-Soul/simulation/EXECUTION_RECORD.json",
  "params_sha256": "d7ad67aa320f65beb659f9a7a95a2506d04bf92ddf73a32822d9141f3d150722",
  "n_checks": 3,
  "results": {
   "Pass": 3,
   "Fail": 0,
   "Supported": 0,
   "Not supported": 0,
   "Reported": 0,
   "Indeterminate": 0
  }
 },
 {
  "sim_id": "SIM-R4-C0",
  "cycle": "C0",
  "report": "R4",
  "iteration": null,
  "archived": false,
  "directory": "Report-4-Spirit/simulation",
  "script": "Report-4-Spirit/simulation/sim_spirit.py",
  "spec": "Report-4-Spirit/simulation/SPEC.md",
  "params": "Report-4-Spirit/simulation/params.json",
  "execution_record": "Report-4-Spirit/simulation/EXECUTION_RECORD.json",
  "params_sha256": "58e60bc7c0d3c2ef455179c1ff7b705e4f43951e3a78c3d22a79bb7131b50211",
  "n_checks": 5,
  "results": {
   "Pass": 5,
   "Fail": 0,
   "Supported": 0,
   "Not supported": 0,
   "Reported": 0,
   "Indeterminate": 0
  }
 },
 {
  "sim_id": "SIM-R4-C0",
  "cycle": "C0",
  "report": "R4",
  "iteration": null,
  "archived": true,
  "directory": "Report-4-Spirit/simulation/archive_v1",
  "script": "Report-4-Spirit/simulation/archive_v1/sim_spirit.py",
  "spec": "Report-4-Spirit/simulation/archive_v1/SPEC.md",
  "params": "Report-4-Spirit/simulation/archive_v1/params.json",
  "execution_record": "Report-4-Spirit/simulation/archive_v1/EXECUTION_RECORD.json",
  "params_sha256": "8200af7fda784089fab314cdb7d347da9ee9e1aea88947a77279a7a01fecb4f1",
  "n_checks": 3,
  "results": {
   "Pass": 2,
   "Fail": 1,
   "Supported": 0,
   "Not supported": 0,
   "Reported": 0,
   "Indeterminate": 0
  }
 },
 {
  "sim_id": "SIM-R5-C0",
  "cycle": "C0",
  "report": "R5",
  "iteration": null,
  "archived": false,
  "directory": "Report-5-Consciousness/simulation",
  "script": "Report-5-Consciousness/simulation/sim_ignition.py",
  "spec": "Report-5-Consciousness/simulation/SPEC.md",
  "params": "Report-5-Consciousness/simulation/params.json",
  "execution_record": "Report-5-Consciousness/simulation/EXECUTION_RECORD.json",
  "params_sha256": "923bfeb8100173437ea75b0b33ef00f44139401d6a79c2d8fad7b35be24b47d9",
  "n_checks": 3,
  "results": {
   "Pass": 3,
   "Fail": 0,
   "Supported": 0,
   "Not supported": 0,
   "Reported": 0,
   "Indeterminate": 0
  }
 },
 {
  "sim_id": "SIM-R6-C0",
  "cycle": "C0",
  "report": "R6",
  "iteration": null,
  "archived": false,
  "directory": "Report-6-Earth/simulation",
  "script": "Report-6-Earth/simulation/sim_earth.py",
  "spec": "Report-6-Earth/simulation/SPEC.md",
  "params": "Report-6-Earth/simulation/params.json",
  "execution_record": "Report-6-Earth/simulation/EXECUTION_RECORD.json",
  "params_sha256": "27e22ebbf15f7cd152678b83ab974a298a7581f07306c391cf7d50d9f1ba6fed",
  "n_checks": 4,
  "results": {
   "Pass": 4,
   "Fail": 0,
   "Supported": 0,
   "Not supported": 0,
   "Reported": 0,
   "Indeterminate": 0
  }
 },
 {
  "sim_id": "SIM-R7-C0",
  "cycle": "C0",
  "report": "R7",
  "iteration": null,
  "archived": false,
  "directory": "Report-7-Unified/simulation",
  "script": "Report-7-Unified/simulation/sim_unified.py",
  "spec": "Report-7-Unified/simulation/SPEC.md",
  "params": "Report-7-Unified/simulation/params.json",
  "execution_record": "Report-7-Unified/simulation/EXECUTION_RECORD.json",
  "params_sha256": "8d8a9bb93dae9400d9503114352539e1ff05a362e1033e3361c675c760211eb1",
  "n_checks": 10,
  "results": {
   "Pass": 10,
   "Fail": 0,
   "Supported": 0,
   "Not supported": 0,
   "Reported": 0,
   "Indeterminate": 0
  }
 },
 {
  "sim_id": "SIM-R1-C1",
  "cycle": "C1",
  "report": "R1",
  "iteration": 1,
  "archived": false,
  "directory": "Report-1-Body/simulation/iter-1",
  "script": "Report-1-Body/simulation/sim_r1.py",
  "spec": "Report-1-Body/simulation/iter-1/SPEC.md",
  "params": "Report-1-Body/simulation/iter-1/params.json",
  "execution_record": "Report-1-Body/simulation/iter-1/EXECUTION_RECORD.json",
  "params_sha256": "12e440a7d3eb0fcb27776cb981f2aa430b6769cb06b46890ee3508a045c047d1",
  "n_checks": 2,
  "results": {
   "Pass": 2,
   "Fail": 0,
   "Supported": 0,
   "Not supported": 0,
   "Reported": 0,
   "Indeterminate": 0
  }
 },
 {
  "sim_id": "SIM-R1-C1",
  "cycle": "C1",
  "report": "R1",
  "iteration": 2,
  "archived": false,
  "directory": "Report-1-Body/simulation/iter-2",
  "script": "Report-1-Body/simulation/sim_r1.py",
  "spec": "Report-1-Body/simulation/iter-2/SPEC.md",
  "params": "Report-1-Body/simulation/iter-2/params.json",
  "execution_record": "Report-1-Body/simulation/iter-2/EXECUTION_RECORD.json",
  "params_sha256": "581d57c986c8d2e7fd77bff12295c092d443f767d80a63f07c1abdf072a7604b",
  "n_checks": 4,
  "results": {
   "Pass": 1,
   "Fail": 0,
   "Supported": 2,
   "Not supported": 0,
   "Reported": 1,
   "Indeterminate": 0
  }
 },
 {
  "sim_id": "SIM-R1-C1",
  "cycle": "C1",
  "report": "R1",
  "iteration": 3,
  "archived": false,
  "directory": "Report-1-Body/simulation/iter-3",
  "script": "Report-1-Body/simulation/sim_r1.py",
  "spec": "Report-1-Body/simulation/iter-3/SPEC.md",
  "params": "Report-1-Body/simulation/iter-3/params.json",
  "execution_record": "Report-1-Body/simulation/iter-3/EXECUTION_RECORD.json",
  "params_sha256": "dff87cc1d63caf11a027f4c6d20142958c12286f357d64464a210064c58cf80b",
  "n_checks": 3,
  "results": {
   "Pass": 1,
   "Fail": 0,
   "Supported": 1,
   "Not supported": 1,
   "Reported": 0,
   "Indeterminate": 0
  }
 },
 {
  "sim_id": "SIM-R2-C1",
  "cycle": "C1",
  "report": "R2",
  "iteration": 1,
  "archived": false,
  "directory": "Report-2-Mind/simulation/iter-1",
  "script": "Report-2-Mind/simulation/sim_r2.py",
  "spec": "Report-2-Mind/simulation/iter-1/SPEC.md",
  "params": "Report-2-Mind/simulation/iter-1/params.json",
  "execution_record": "Report-2-Mind/simulation/iter-1/EXECUTION_RECORD.json",
  "params_sha256": "2bb09e4746e8d7f5d5cbdee319d755f51a47798c91953335470f5a5c702984de",
  "n_checks": 2,
  "results": {
   "Pass": 1,
   "Fail": 0,
   "Supported": 1,
   "Not supported": 0,
   "Reported": 0,
   "Indeterminate": 0
  }
 },
 {
  "sim_id": "SIM-R2-C1",
  "cycle": "C1",
  "report": "R2",
  "iteration": 2,
  "archived": false,
  "directory": "Report-2-Mind/simulation/iter-2",
  "script": "Report-2-Mind/simulation/sim_r2.py",
  "spec": "Report-2-Mind/simulation/iter-2/SPEC.md",
  "params": "Report-2-Mind/simulation/iter-2/params.json",
  "execution_record": "Report-2-Mind/simulation/iter-2/EXECUTION_RECORD.json",
  "params_sha256": "cd43c950568a5d9e55c19ec6683ee54ae1338979cf7dcc1b11b99d34d5c18728",
  "n_checks": 2,
  "results": {
   "Pass": 1,
   "Fail": 0,
   "Supported": 1,
   "Not supported": 0,
   "Reported": 0,
   "Indeterminate": 0
  }
 },
 {
  "sim_id": "SIM-R2-C1",
  "cycle": "C1",
  "report": "R2",
  "iteration": 3,
  "archived": false,
  "directory": "Report-2-Mind/simulation/iter-3",
  "script": "Report-2-Mind/simulation/sim_r2.py",
  "spec": "Report-2-Mind/simulation/iter-3/SPEC.md",
  "params": "Report-2-Mind/simulation/iter-3/params.json",
  "execution_record": "Report-2-Mind/simulation/iter-3/EXECUTION_RECORD.json",
  "params_sha256": "e3f316817f1ca3e582a18e1f6f48fdaa2c2b208a3afc36fc20db9824be7f9390",
  "n_checks": 2,
  "results": {
   "Pass": 0,
   "Fail": 0,
   "Supported": 1,
   "Not supported": 0,
   "Reported": 1,
   "Indeterminate": 0
  }
 },
 {
  "sim_id": "SIM-R3-C1",
  "cycle": "C1",
  "report": "R3",
  "iteration": 1,
  "archived": false,
  "directory": "Report-3-Soul/simulation/iter-1",
  "script": "Report-3-Soul/simulation/sim_r3.py",
  "spec": "Report-3-Soul/simulation/iter-1/SPEC.md",
  "params": "Report-3-Soul/simulation/iter-1/params.json",
  "execution_record": "Report-3-Soul/simulation/iter-1/EXECUTION_RECORD.json",
  "params_sha256": "3ee4832a5d081a56cabe9ca179e7e80a3e48171aa243b7b0b02a0cc1b3ea4fac",
  "n_checks": 4,
  "results": {
   "Pass": 1,
   "Fail": 0,
   "Supported": 1,
   "Not supported": 1,
   "Reported": 1,
   "Indeterminate": 0
  }
 },
 {
  "sim_id": "SIM-R3-C1",
  "cycle": "C1",
  "report": "R3",
  "iteration": 2,
  "archived": false,
  "directory": "Report-3-Soul/simulation/iter-2",
  "script": "Report-3-Soul/simulation/sim_r3.py",
  "spec": "Report-3-Soul/simulation/iter-2/SPEC.md",
  "params": "Report-3-Soul/simulation/iter-2/params.json",
  "execution_record": "Report-3-Soul/simulation/iter-2/EXECUTION_RECORD.json",
  "params_sha256": "31975861df485a96fa5652a50841eac1150c6d4912d94d9907f2ef07f9f1c4fd",
  "n_checks": 4,
  "results": {
   "Pass": 1,
   "Fail": 0,
   "Supported": 1,